Tema;Sudėtingumas;Autorius;Klausimo tekstas;Atsakymo var. nr. 1;Atsakymo var. nr. 2;Atsakymo var. nr. 3;Atsakymo var. nr. 4;Atsakymas
Įžymybės;8;Aloyzas;Kuris dailininkas nutapė „Vandens lelijas“ 1899?;Vincent Van Gogh;Henri Matisse;Claude Monet;Edward Hopper;Claude Monet
Geografija;6;Antanas;Kuris miestas yra Peru sostinė?;Santjagas;Buenos Airės;Lima;Rio De Žaneiras;Lima
Geografija;6;Antanas;Kuris miestas yra Peru sostinė?;Santjagas;Buenos Airės;Lima;Rio De Žaneiras;Lima
Įžymybės;8;Antanas;Koks reperio P Diddy tikrasis vardas?;Sean Combs;Shawn Carter;Curtis Jackson;Earl Simmons;Sean Combs
Muzika;9;Martynas;Miuziklas „Hamilton“ tapo vienu žymiausiu visų laikų muzikinio teatro pasirodymų nuo debiuto 2015 metais, tačiau kuo vardu jį parašęs dramaturgas?;Lin-Manuel Miranda;Kenneth Lonergan;Lynn Nottage;Andrew Bovell;Lin-Manuel Miranda
